{"schema_version":"product-behavior-verification.v1","surface":{"surface_id":"surface:model-room-job-passport-eval","surface_version":"v1","commit_ref":"execution-fabric-v1"},"binding":{"work_request_id":"wr-synthetic-read-only","projection_digest":"sha256:7ef1df546040c0aa000a437902fdc4d83decaf1960f63001790b11a422b5dfb9","execution_evidence_refs":["browser_live:model-room-eval-ladder-desktop","browser_live:model-room-eval-ladder-narrow"]},"state_chart":{"starting_state":["portfolio absent leaves the existing card honest"],"immediate_ending":["exact-bound portfolio reveals the diagnostic ladder"],"becoming_extended":["stage outcomes are readable without color"],"while_extended":["critical regression and cost remain adjacent"],"finishing":["no portfolio state promotes a candidate"],"modifiers_variants":["passed failed blocked unknown remain textual"],"cancel_interrupt":["unknown and blocked do not become passed"],"cross_system_effects":["wire portfolio is projection evidence not authority"],"edge_cases":["mismatched projection digest is withheld"],"open_verification":["live traffic remains unavailable"]},"claims":[{"claim_id":"claim:eval-ladder-visible","state_ref":"while_extended","priority":"P0","observable_claim":"The card shows every rung, named stage outcomes, the critical visual-accessibility regression, and candidate latency/cost without an aggregate score."}],"items":[{"item_id":"bvi:eval-ladder-visible","claim_id":"claim:eval-ladder-visible","priority":"P0","setup":"Serve the synthetic typed rehearsal with its exact-bound portfolio.","steps":["Load Model Room at desktop width.","Load Model Room at narrow width."],"expected":"Rungs, stage diagnostics, not-eligible state, visual-accessibility regression, and cost/latency remain visible and textual.","status":"passed","evidence_refs":["browser_live:model-room-eval-ladder-desktop","browser_live:model-room-eval-ladder-narrow"]}],"findings":[],"audit_state":"draft"}
