{"schema_version":"product-behavior-verification.v1","surface":{"surface_id":"surface:model-room-job-passport","surface_version":"v1","commit_ref":"d73363ae+execution-fabric-v1"},"binding":{"work_request_id":"wr-synthetic-read-only","projection_digest":"sha256:7ef1df546040c0aa000a437902fdc4d83decaf1960f63001790b11a422b5dfb9","execution_evidence_refs":["evidence:synthetic-check"]},"state_chart":{"starting_state":["feature hidden when the wire has no valid observatory projection","loading wire keeps the existing room skeleton honest"],"immediate_ending":["a valid projection reveals one Work Request card","a malformed typed receipt is withheld"],"becoming_extended":["component button opens evidence and checkpoint detail","keyboard focus reaches every component and disclosure"],"while_extended":["profile identity and actual model/harness remain separately labeled","timeline names declared and observed movement without raw transcript"],"finishing":["verified success shows independently verified complete","stale remains visibly stale rather than looking current"],"modifiers_variants":["aligned,deviation-candidate,blocked,quiet,stale,failed,unknown-partial,verified-complete remain distinct","narrow width wraps staffing and topology"],"cancel_interrupt":["timeout,cancellation,partial and unknown remain non-success terminal states","interrupted/resumed work requires a new attempt and checkpoint"],"cross_system_effects":["wire stores typed receipt while Model Room only projects it","repository/worktree remains a resource under Work Request"],"edge_cases":["same state version with conflicting canonical digest is unknown/partial","filesystem-only activity does not create a deviation candidate"],"open_verification":["live four-provider wire traffic remains unavailable in this offline slice"]},"claims":[{"claim_id":"claim:passport-hidden-empty","state_ref":"starting_state","priority":"P1","observable_claim":"Without a valid projection the Job Passport panel is absent."},{"claim_id":"claim:passport-current","state_ref":"immediate_ending","priority":"P0","observable_claim":"A valid projection renders the Work Request, canonical state version, and current observed state."},{"claim_id":"claim:passport-statuses","state_ref":"modifiers_variants","priority":"P0","observable_claim":"Each declared status has a text label and never relies on color or motion alone."},{"claim_id":"claim:passport-drilldown","state_ref":"becoming_extended","priority":"P1","observable_claim":"A component control opens evidence and checkpoint detail using keyboard-operable native controls."},{"claim_id":"claim:passport-staffing","state_ref":"while_extended","priority":"P0","observable_claim":"Persistent profile and actual surface/model/harness are visibly separate."},{"claim_id":"claim:passport-observation","state_ref":"while_extended","priority":"P0","observable_claim":"Declared coverage, observation fidelity, uncertainty, and deviation candidates remain distinct."},{"claim_id":"claim:passport-timeline","state_ref":"while_extended","priority":"P1","observable_claim":"The observed timeline presents sequence, declared step, observed movement, and retention without transcript text."},{"claim_id":"claim:passport-checkpoint","state_ref":"finishing","priority":"P1","observable_claim":"Evidence detail says whether independent verification permits a verified-checkpoint handoff."},{"claim_id":"claim:passport-accessibility","state_ref":"becoming_extended","priority":"P0","observable_claim":"Important meaning survives keyboard use, reduced motion, and narrow width."},{"claim_id":"claim:passport-ordering","state_ref":"edge_cases","priority":"P0","observable_claim":"Stale, malformed, or conflicting receipts cannot silently overwrite newer canonical state."},{"claim_id":"claim:passport-provider-variants","state_ref":"open_verification","priority":"P1","observable_claim":"Claude, Codex, Hermes, and Grok native transport payloads retain comparable visual staffing shape."},{"claim_id":"claim:passport-interruption","state_ref":"cancel_interrupt","priority":"P1","observable_claim":"Interrupted and resumed attempts stay distinct from verified completion and preserve checkpoint-only handoff."}],"items":[{"item_id":"bvi:empty-hidden","claim_id":"claim:passport-hidden-empty","priority":"P1","setup":"Open Model Room with no typed projection receipt.","steps":["Load the room."],"expected":"No Job Passport panel is shown.","status":"planned","evidence_refs":["test:job-passport-panel-empty"]},{"item_id":"bvi:current-card","claim_id":"claim:passport-current","priority":"P0","setup":"Publish the synthetic Codex observatory projection on the wire.","steps":["Load the room."],"expected":"The Job Passport card names wr-synthetic-read-only and state v1.","status":"passed","evidence_refs":["browser_live:model-room-preview-current-desktop"]},{"item_id":"bvi:status-chart","claim_id":"claim:passport-statuses","priority":"P0","setup":"Use synthetic state variants.","steps":["Render each state."],"expected":"Text distinguishes aligned, deviation candidate, blocked, quiet, stale, failed, unknown/partial, and verified complete.","status":"planned","evidence_refs":["test:job-passport-panel-statuses"]},{"item_id":"bvi:component-detail","claim_id":"claim:passport-drilldown","priority":"P1","setup":"Load a valid projection with a component.","steps":["Tab to the component.","Press Enter."],"expected":"Evidence and checkpoint detail opens.","status":"passed","evidence_refs":["browser_live:model-room-preview-keyboard-detail-persistent"]},{"item_id":"bvi:staffing-separation","claim_id":"claim:passport-staffing","priority":"P0","setup":"Load Doc staffed by Codex fixture.","steps":["Inspect staffing cards."],"expected":"Doc is separate from Codex/Codex harness.","status":"passed","evidence_refs":["browser_live:model-room-preview-profile-staffing"]},{"item_id":"bvi:observed-alignment","claim_id":"claim:passport-observation","priority":"P0","setup":"Load native-hook and filesystem-only variants.","steps":["Inspect alignment text."],"expected":"Filesystem-only remains uncertain and does not declare deviation.","status":"planned","evidence_refs":["test:job-passport-panel-statuses"]},{"item_id":"bvi:timeline","claim_id":"claim:passport-timeline","priority":"P1","setup":"Load projection with one progress event.","steps":["Inspect the timeline."],"expected":"Sequence, declared step, event and retention are visible.","status":"planned","evidence_refs":["test:job-passport-artifact"]},{"item_id":"bvi:checkpoint","claim_id":"claim:passport-checkpoint","priority":"P1","setup":"Load verified and unverified receipt variants.","steps":["Open detail."],"expected":"Checkpoint handoff posture follows independent verification.","status":"planned","evidence_refs":["test:job-passport-artifact"]},{"item_id":"bvi:accessibility","claim_id":"claim:passport-accessibility","priority":"P0","setup":"Use keyboard, reduced-motion media and 560px viewport.","steps":["Tab through controls.","Enable reduced motion.","Narrow viewport."],"expected":"Controls retain focus and meaning remains textual.","status":"passed","evidence_refs":["browser_live:model-room-preview-narrow-no-overflow"]},{"item_id":"bvi:ordering","claim_id":"claim:passport-ordering","priority":"P0","setup":"Send newer, stale, and same-version conflict receipts.","steps":["Load the room."],"expected":"Newer survives, stale is withheld, conflict is unknown/partial.","status":"planned","evidence_refs":["test:job-passport-panel-ordering"]},{"item_id":"bvi:providers","claim_id":"claim:passport-provider-variants","priority":"P1","setup":"Four offline native transport fixtures.","steps":["Project each adapter."],"expected":"Staffing fields remain comparable.","status":"planned","evidence_refs":["test:execution-contract-comparable"]},{"item_id":"bvi:interruption","claim_id":"claim:passport-interruption","priority":"P1","setup":"Timeout, cancellation, partial, unknown and replacement fixtures.","steps":["Project each terminal state."],"expected":"None looks verified complete without independent verification.","status":"planned","evidence_refs":["test:execution-contract-terminal"]}],"findings":[{"finding_id":"finding:passport-keyboard-poll","root_cause_key":"cause:passport-drilldown-event-and-reconcile","actual":"Component drilldown was pointer-only in the browser check and its open state reset on the next wire poll.","expected":"Enter/Space opens the evidence detail and the chosen disclosure survives a wire refresh.","repro":["Load the fixture-backed Model Room.","Focus execution fabric current.","Press Enter and wait one poll."],"code_location":"dealroom/js/room.js renderJobPassport","severity":"P1","decision":"fix","post_fix_status":"verified_fixed","evidence_refs":["browser_live:model-room-preview-keyboard-detail-persistent"]},{"finding_id":"finding:passport-mobile-grid","root_cause_key":"cause:passport-mobile-auto-track","actual":"At 560px the Passport collapsed or overlapped the wire because the mobile grid allocated a zero-height auto track.","expected":"The Passport owns a content-sized mobile row, precedes the wire, and does not create horizontal overflow.","repro":["Set viewport to 560px.","Load the fixture-backed Model Room.","Inspect the Passport and wire positions."],"code_location":"dealroom/css/room.css mobile grid","severity":"P0","decision":"fix","post_fix_status":"verified_fixed","evidence_refs":["browser_live:model-room-preview-narrow-no-overflow"]}],"audit_state":"draft"}
